{
  "id": "283",
  "slug": "imanuel",
  "title": "Imanuel",
  "number": 283,
  "key": "F",
  "tempo": 120,
  "language": "cs",
  "tags": [],
  "sourcePdf": "https://zpevnik.proscholy.cz/soubor/283.xml",
  "sourcePages": [
    1
  ],
  "hasStaffImages": false,
  "staveCount": 0,
  "reviewStatus": "auto"
}
