{
  "id": "566",
  "slug": "radostnou-zpravu-nesu",
  "title": "Radostnou zprávu nesu",
  "number": 612,
  "key": "Em",
  "tempo": 120,
  "language": "cs",
  "tags": [],
  "sourcePdf": "https://zpevnik.proscholy.cz/soubor/612.xml",
  "sourcePages": [
    1
  ],
  "hasStaffImages": false,
  "staveCount": 0,
  "reviewStatus": "auto"
}
