{
  "id": "347",
  "slug": "promeneni",
  "title": "Proměnění",
  "number": 390,
  "key": "G",
  "tempo": 120,
  "language": "cs",
  "tags": [],
  "sourcePdf": "https://zpevnik.proscholy.cz/soubor/390.xml",
  "sourcePages": [
    1
  ],
  "hasStaffImages": false,
  "staveCount": 0,
  "reviewStatus": "auto"
}
