{
  "id": "446",
  "slug": "vesele-zpivejme-boha-otce-chvalme",
  "title": "Vesele zpívejme, Boha Otce chvalme",
  "number": 446,
  "key": "Eb",
  "tempo": 120,
  "language": "cs",
  "tags": [],
  "sourcePdf": "https://zpevnik.proscholy.cz/soubor/446.xml",
  "sourcePages": [
    1
  ],
  "hasStaffImages": false,
  "staveCount": 0,
  "reviewStatus": "auto"
}
