{
  "id": "362",
  "slug": "ej-nuz-lacni-ziznivi-pokrmu-pane-zadostivi",
  "title": "Ej nuž, lační, žízniví, pokrmu Páně žádostiví",
  "number": 362,
  "key": "F",
  "tempo": 120,
  "language": "cs",
  "tags": [],
  "sourcePdf": "https://zpevnik.proscholy.cz/soubor/362.xml",
  "sourcePages": [
    1
  ],
  "hasStaffImages": false,
  "staveCount": 0,
  "reviewStatus": "auto"
}
