{
  "id": "735",
  "slug": "ty-jsi-muj-buh",
  "title": "Ty jsi můj Bůh",
  "number": 735,
  "key": "Bb",
  "tempo": 120,
  "language": "cs",
  "tags": [],
  "sourcePdf": "https://zpevnik.proscholy.cz/soubor/735.xml",
  "sourcePages": [
    1
  ],
  "hasStaffImages": false,
  "staveCount": 0,
  "reviewStatus": "auto"
}
