{
  "id": "425",
  "slug": "zaradoval-jsem-se-kdyz-mi-rekli",
  "title": "Zaradoval jsem se, když mi řekli",
  "number": 425,
  "key": "G",
  "tempo": 120,
  "language": "cs",
  "tags": [],
  "sourcePdf": "https://zpevnik.proscholy.cz/soubor/425.xml",
  "sourcePages": [
    1
  ],
  "hasStaffImages": false,
  "staveCount": 0,
  "reviewStatus": "auto"
}
