{
  "id": "469",
  "slug": "chci-byt-tam-kde-ty-jsi-rad",
  "title": "Chci být tam, kde Ty jsi rád",
  "number": 469,
  "key": "F",
  "tempo": 120,
  "language": "cs",
  "tags": [],
  "sourcePdf": "https://zpevnik.proscholy.cz/soubor/469.xml",
  "sourcePages": [
    1
  ],
  "hasStaffImages": false,
  "staveCount": 0,
  "reviewStatus": "auto"
}
