{
  "id": "007",
  "slug": "at-chvali-duse-ma-ted-pana",
  "title": "Ať chválí duše má teď Pána",
  "number": 7,
  "key": "C",
  "tempo": 120,
  "language": "cs",
  "tags": [],
  "sourcePdf": "https://zpevnik.proscholy.cz/soubor/7.xml",
  "sourcePages": [
    1
  ],
  "hasStaffImages": false,
  "staveCount": 0,
  "reviewStatus": "auto"
}
