{
  "id": "325",
  "slug": "boze-otce-vecnosti-stvoriteli-mocny",
  "title": "Bože, Otče věčnosti, Stvořiteli mocný",
  "number": 325,
  "key": "C",
  "tempo": 120,
  "language": "cs",
  "tags": [],
  "sourcePdf": "https://zpevnik.proscholy.cz/soubor/325.xml",
  "sourcePages": [
    1
  ],
  "hasStaffImages": false,
  "staveCount": 0,
  "reviewStatus": "auto"
}
