{
  "id": "733",
  "slug": "tma-a-pusto-kolem-je-ztracen-jsem-a-sam",
  "title": "Tma a pusto kolem je, ztracen jsem a sám",
  "number": 733,
  "key": "F",
  "tempo": 120,
  "language": "cs",
  "tags": [],
  "sourcePdf": "https://zpevnik.proscholy.cz/soubor/733.xml",
  "sourcePages": [
    1
  ],
  "hasStaffImages": false,
  "staveCount": 0,
  "reviewStatus": "auto"
}
