{
  "id": "483",
  "slug": "neboj-se-ja-jsem-s-tebou",
  "title": "Neboj se, Já jsem s tebou",
  "number": 528,
  "key": "F",
  "tempo": 120,
  "language": "cs",
  "tags": [],
  "sourcePdf": "https://zpevnik.proscholy.cz/soubor/528.xml",
  "sourcePages": [
    1
  ],
  "hasStaffImages": false,
  "staveCount": 0,
  "reviewStatus": "auto"
}
