{
  "id": "425",
  "slug": "pan-buh-sam-at-nam-vsem-pozehna",
  "title": "Pán Bůh sám ať nám všem požehná",
  "number": 425,
  "key": "G",
  "tempo": 120,
  "language": "cs",
  "tags": [],
  "sourcePdf": "https://zpevnik.proscholy.cz/soubor/425.xml",
  "sourcePages": [
    1
  ],
  "hasStaffImages": false,
  "staveCount": 0,
  "reviewStatus": "auto"
}
