{
  "id": "454",
  "slug": "noc-ke-konci-se-kloni-a-blizko-je-svit-dne",
  "title": "Noc ke konci se kloní a blízko je svit dne",
  "number": 454,
  "key": "Eb",
  "tempo": 120,
  "language": "cs",
  "tags": [],
  "sourcePdf": "https://zpevnik.proscholy.cz/soubor/454.xml",
  "sourcePages": [
    1
  ],
  "hasStaffImages": false,
  "staveCount": 0,
  "reviewStatus": "auto"
}
