{
  "id": "652",
  "slug": "praci-denni-vykonavse-a",
  "title": "Práci denní vykonavše a",
  "number": 652,
  "key": "F",
  "tempo": 120,
  "language": "cs",
  "tags": [],
  "sourcePdf": "https://zpevnik.proscholy.cz/soubor/652.xml",
  "sourcePages": [
    1
  ],
  "hasStaffImages": false,
  "staveCount": 0,
  "reviewStatus": "auto"
}
