{
  "id": "316",
  "slug": "dej-odvahu-vcas-slyset",
  "title": "Dej odvahu včas slyšet",
  "number": 316,
  "key": "G",
  "tempo": 120,
  "language": "cs",
  "tags": [],
  "sourcePdf": "https://zpevnik.proscholy.cz/soubor/316.xml",
  "sourcePages": [
    1
  ],
  "hasStaffImages": false,
  "staveCount": 0,
  "reviewStatus": "auto"
}
