{
  "id": "174",
  "slug": "lord-i-lift-your-name-on-high",
  "title": "Lord, I Lift Your Name on High",
  "number": 174,
  "key": "F",
  "tempo": 120,
  "language": "cs",
  "tags": [],
  "sourcePdf": "https://zpevnik.proscholy.cz/soubor/174.xml",
  "sourcePages": [
    1
  ],
  "hasStaffImages": false,
  "staveCount": 0,
  "reviewStatus": "auto"
}
