{
  "id": "236",
  "slug": "hoden-jsi-nasi-chvaly",
  "title": "Hoden jsi naší chvály",
  "number": 268,
  "key": "F#m",
  "tempo": 120,
  "language": "cs",
  "tags": [],
  "sourcePdf": "https://zpevnik.proscholy.cz/soubor/268.xml",
  "sourcePages": [
    1
  ],
  "hasStaffImages": false,
  "staveCount": 0,
  "reviewStatus": "auto"
}
