{
  "id": "016",
  "slug": "confitemini-domino",
  "title": "Confitemini Domino",
  "number": 14,
  "key": "Eb",
  "tempo": 120,
  "language": "cs",
  "tags": [],
  "sourcePdf": "https://zpevnik.proscholy.cz/soubor/14.xml",
  "sourcePages": [
    1
  ],
  "hasStaffImages": false,
  "staveCount": 0,
  "reviewStatus": "auto"
}
