{
  "id": "662",
  "slug": "ubi-caritas",
  "title": "Ubi caritas",
  "number": 662,
  "key": "D",
  "tempo": 120,
  "language": "cs",
  "tags": [],
  "sourcePdf": "https://zpevnik.proscholy.cz/soubor/662.xml",
  "sourcePages": [
    1
  ],
  "hasStaffImages": false,
  "staveCount": 0,
  "reviewStatus": "auto"
}
