{
  "id": "200",
  "slug": "beranku-muj-ja-chci-jit-za-tebou",
  "title": "Beránku můj, já chci jít za Tebou",
  "number": 231,
  "key": "G",
  "tempo": 120,
  "language": "cs",
  "tags": [],
  "sourcePdf": "https://zpevnik.proscholy.cz/soubor/231.xml",
  "sourcePages": [
    1
  ],
  "hasStaffImages": false,
  "staveCount": 0,
  "reviewStatus": "auto"
}
