{
  "id": "663",
  "slug": "slava-panu-jezisi",
  "title": "Sláva Pánu Ježíši",
  "number": 713,
  "key": "D",
  "tempo": 120,
  "language": "cs",
  "tags": [],
  "sourcePdf": "https://zpevnik.proscholy.cz/soubor/713.xml",
  "sourcePages": [
    1
  ],
  "hasStaffImages": false,
  "staveCount": 0,
  "reviewStatus": "auto"
}
